================================================================================
DP SOLUTIONS TEST REPORT
================================================================================

✅ PASS DP-001-staircase-cracked-steps-maxjump
    Sample: 2/2
    Public: 3/3
    Hidden: 39/39

✅ PASS DP-002-capped-coin-change-penalty
    Sample: 2/2
    Public: 3/3
    Hidden: 39/39

✅ PASS DP-003-required-weight-knapsack
    Sample: 2/2
    Public: 3/3
    Hidden: 39/39

✅ PASS DP-004-exact-count-subset-sum
    Sample: 2/2
    Public: 3/3
    Hidden: 39/39

✅ PASS DP-005-keyboard-row-edit-distance-shift
    Sample: 2/2
    Public: 3/3
    Hidden: 39/39

❌ FAIL DP-006-strict-jump-lis-bounded
    Sample: 2/2
    Public: 3/3
    Hidden: 36/39

    HIDDEN FAILURES:
      Test 1:
        Input: 50000
0 1 2 3 4 5 6 7 8 9 10 11 12 13 14 15 16 17 18 19 20 21 22 23 24 25 26 27 28 29 30 31 32 33 34
        Expected: 50000
        Got: 25000
      Test 2:
        Input: 75000
0 1 2 3 4 5 6 7 8 9 10 11 12 13 14 15 16 17 18 19 20 21 22 23 24 25 26 27 28 29 30 31 32 33 34
        Expected: 75000
        Got: 37500
      Test 3:
        Input: 100000
0 1 2 3 4 5 6 7 8 9 10 11 12 13 14 15 16 17 18 19 20 21 22 23 24 25 26 27 28 29 30 31 32 33 3
        Expected: 100000
        Got: 50000

✅ PASS DP-007-auditorium-max-sum-gap-three
    Sample: 2/2
    Public: 3/3
    Hidden: 39/39

❌ FAIL DP-008-grid-paths-turn-limit
    Sample: 2/2
    Public: 3/3
    Hidden: 36/39

    HIDDEN FAILURES:
      Test 1:
        Input: 50 50 25
        Expected: 232307878464406
        Got: 429618969
      Test 2:
        Input: 75 75 37
        Expected: 123456789012345
        Got: 600610019
      Test 3:
        Input: 100 100 50
        Expected: 987654321098765
        Got: 971776173

❌ FAIL DP-009-flooded-campus-min-cost-free
    Sample: 2/2
    Public: 1/3
    Hidden: 14/39

    PUBLIC FAILURES:
      Test 1:
        Input: 2 2
2 1
1 2
0
        Expected: 3
        Got: 5
      Test 2:
        Input: 2 3
1 5 1
2 2 2
2
        Expected: 1
        Got: 2

    HIDDEN FAILURES:
      Test 1:
        Input: 2 3
1 7 1
4 5 2
1
        Expected: 8
        Got: 4
      Test 2:
        Input: 2 4
1 1 5 2
1 3 2 2
2
        Expected: 7
        Got: 4
      Test 3:
        Input: 3 4
2 2 1 0
2 5 5 2
0 0 2 5
1
        Expected: 7
        Got: 6
      ... and 22 more failures

✅ PASS DP-010-lcs-with-skips
    Sample: 2/2
    Public: 3/3
    Hidden: 39/39

❌ FAIL DP-011-expression-target-mod-minus
    Sample: 1/2
    Public: 0/3
    Hidden: 13/39

    SAMPLE FAILURES:
      Test 1:
        Input: 1234
7 0 2
        Expected: 5
        Got: 2

    PUBLIC FAILURES:
      Test 1:
        Input: 12
3 0 2
        Expected: 2
        Got: 0
      Test 2:
        Input: 505
5 0 3
        Expected: 14
        Got: 4
      Test 3:
        Input: 123
4 1 2
        Expected: 2
        Got: 1

    HIDDEN FAILURES:
      Test 1:
        Input: 7631
9 0 4
        Expected: 8
        Got: 4
      Test 2:
        Input: 9074
5 4 1
        Expected: 2
        Got: 0
      Test 3:
        Input: 35337
6 0 4
        Expected: 34
        Got: 13
      ... and 23 more failures

❌ FAIL DP-012-balanced-partition-size-limit
    Sample: 2/2
    Public: 3/3
    Hidden: 37/39

    HIDDEN FAILURES:
      Test 1:
        Input: 25 0
1 1 1 1 1 1 1 1 1 1 1 1 1 1 1 1 1 1 1 1 1 1 1 1 1
        Expected: 13
        Got: -1
      Test 2:
        Input: 37 0
1 1 1 1 1 1 1 1 1 1 1 1 1 1 1 1 1 1 1 1 1 1 1 1 1 1 1 1 1 1 1 1 1 1 1 1 1
        Expected: 19
        Got: -1

✅ PASS DP-013-paint-fence-switch-cost
    Sample: 2/2
    Public: 3/3
    Hidden: 39/39

❌ FAIL DP-014-constrained-decode-ways
    Sample: 2/2
    Public: 3/3
    Hidden: 36/39

    HIDDEN FAILURES:
      Test 1:
        Input: 2222222222222222222222222222222222222222222222222222222222222222222222222222222222222222222222222222
        Expected: 1
        Got: 441423758
      Test 2:
        Input: 2222222222222222222222222222222222222222222222222222222222222222222222222222222222222222222222222222
        Expected: 1
        Got: 257490760
      Test 3:
        Input: 2222222222222222222222222222222222222222222222222222222222222222222222222222222222222222222222222222
        Expected: 1
        Got: 967618232

✅ PASS DP-015-stock-trading-weekly-rest-fee
    Sample: 2/2
    Public: 3/3
    Hidden: 39/39

❌ FAIL DP-016-exams-with-cooldown-gap
    Sample: 2/2
    Public: 3/3
    Hidden: 35/39

    HIDDEN FAILURES:
      Test 1:
        Input: 50000 500000000
1 51 10
101 151 10
201 251 10
301 351 10
401 451 10
501 551 10
601 651 10
701 751 10
        Expected: 500000
        Got: 10
      Test 2:
        Input: 75000 750000000
1 51 10
101 151 10
201 251 10
301 351 10
401 451 10
501 551 10
601 651 10
701 751 10
        Expected: 750000
        Got: 10
      Test 3:
        Input: 100000 1000000000
1 51 10
101 151 10
201 251 10
301 351 10
401 451 10
501 551 10
601 651 10
701 751 
        Expected: 1000000
        Got: 10
      ... and 1 more failures

================================================================================
SUMMARY
================================================================================

SAMPLE: 31/32 (96.9%)
  Failed solutions: DP-011-expression-target-mod-minus

PUBLIC: 43/48 (89.6%)
  Failed solutions: DP-009-flooded-campus-min-cost-free, DP-011-expression-target-mod-minus

HIDDEN: 558/624 (89.4%)
  Failed solutions: DP-006-strict-jump-lis-bounded, DP-008-grid-paths-turn-limit, DP-009-flooded-campus-min-cost-free, DP-011-expression-target-mod-minus, DP-012-balanced-partition-size-limit ... and 2 more
